verdict,text
0, It stands as a unique addition to your collection seamlessly combining function and fashion 
0, Designed with a regular fit this cardigan features an elegant five-button front closure jersey-bound cuffs hem and placket along with versatile multi-use patch pockets 
0, a distinguished piece of knitwear that effortlessly blends comfort and style 
0, Its exceptional comfort timeless design and functional features make it a versatile choice suitable for various settings from casual outings to more formal occasions
0, Universal Works Fleece Cardigan in Grey Marl 
0, Why Silks Loves Effortlessly chic holiday staple
0, The soft drapings and ruching effect is wonderfully flattering It has a detachable strap that can be worn halterneck and a lovely high back that shows off your waist beautifully 
0, Roidal Linda Swimsuit The winner of strapless swimsuits in a stunning emerald green colour 
0, synthetic jersey techno fabric openwork brand logo solid colour with appliqués high waisted elasticized waist slim-leg pants sporty
0, Boot length 4 88 inches Boot width 10 53 inches Heel height 2 34 inches
0, twill belt brand logo solid color high waisted elasticized waist multipockets small sized cargo
0, synthetic jersey brand logo solid color stretch bralette
0, jersey brand logo solid color with print high waisted elasticized waist lifestyle no pockets stretch
0, jersey brand logo solid color with print round collar short sleeves
0, lace crepe frills basic solid color round collar short sleeves no pockets rear closure hook-and-bar zip fully lined stretch pencil style
0, crepe ruffles floral design round collar 3 4 length sleeves no pockets snap button fastening rear closure unlined
0, This garment contains a Digital ID meaning you can discover a world of
0, The model is wearing an Italian size S 40 
0, Cut for a slim fit with long sleeves and a mock-neck silhouette this stylish layer slots easily into your wardrobe 
0, Made in Italy this chenille top from 8 by YOOX will elevate any look 
0, Item made in Italy synonymous with quality and design creativity 
0, Handle drop 6 63 inches Depth 0 98 inches Height 8 97 inches Length of handle 17 55 inches Width 11 51 inches
0, Front closure with five buttons
0, Curved 'V' neck collar
0, Jersey-bound cuffs hem and placket
0, Singular patch chest pocket
0, two generously sized patch hand pockets
0, Convenient inside pocket
0, Get ready for the cold and keep up with the latest trends with the Äike puffer jacket 
0, Built with comfort and warmth in mind this model is lined with a featherless insulation layer and designed with seamless chambers 
0, If you're already a smarty pants then all you need to complete the look is the Smarty 3-in-1 Form Jacket!
0, Durable versatile and warm when you want it to be this 3-in-1 is equipped with the Hoodlink system that makes packing a breeze
0, If you thought you couldn't get any smarter take a spin in the Smarty 3-in-1 Form Jacket and see what happens
0, Raglan sleeeves 
0, Modern Fit – Not too loose not too slim 686's Modern Fit leaves enough room to accommodate all riding styles without sacrificing style
0, With all sealed seams it provides effective protection against rain and the most humid climate 
0, CP Company DD Shell Down Jacket in Olive Night 
0, One of the best items from CP Company's annual offerings this puffer jacket offers a unique aesthetic and total warmth 
0, A two-way zipper makes an appearance alongside zipped pockets for on-the-go storage elasticated cuffs and an adjustable hood and hemline for a perfect fit 
0, The brand's iconic lens completes the look 
0, Roidal Linda Swimsuit The winner of strapless swimsuits in a stunning cobalt blue colour 
0, The soft drapings and ruching effect is wonderfully flattering
0, It has a detachable strap that can be worn halterneck and a lovely high back that shows off your waist beautifully
0, Your kiddo will be ready to face blustery weather with this puffy coat boasting high-density construction and a silky bright finish 
0, Based in Dubai the brand promotes conscious and sustainable apparel offering versatile essentials that are perfect for mixing and matching 
0, Made in India
0, Models Height 5 Feet 9 Inches 175 cm
0, This relaxed-fitting James Lakeland ruffle blouse has a ruffle detail running the length of the front of the blouse and a long sleeve finished with a smock detail cuff
0, A wearable work-to-weekend piece 
0, Ruffle detail Smock detail cuff Futures long sleeve and V neck
0, Keep all your night out essentials safe in our mini pouch Bag 
0, An elegant timeless piece that will match with most if not all outfits
0, This diamante bag features a chainmail strap 
0, You will be sure to get plenty of compliments with this bang on trend Clutch Bag
0, a warming yet breathable wear designed with a ribbed crew neck long sleeves with ribbed wrist cuffs 
0, It doesn't get much more comfortable than this Its extra-stretchy fabric moves with you not against you so you never feel held back on the course
0, Small high stand collar with concealed metal snap buttons
0, Grab your fruity cocktail because this tropical maxi dress is giving us serious island feels
0, Floor-length dresses like this one are hot AF right now and this scoop-back maxi dress is no exception
0, This ankle boot features a classic stiletto heel softly sculpted square toe and subtle stitching details creating a minimalistic design
0, Constructed with a classic slender stiletto heel pointed toe and comfortable footbed Foxy is versatile creating endless styling possibilities
0, These work clogs by Joybees are made for professionals in the culinary and medical space
0, Classic hoop earrings go glam with the addition of sparkling heart shaped cubic zirconia stones 
0, The glasses are finished with a whimsical floral print at the interior and discreet Kate Spade New York logo lettering at the outside
0, They have a Cat Eye shape and come in 3 colors which are Black Deep Turquoise and Mulberry with 2 sizes which are 4917 130 and 5117 135 
0, These running sunglasses are the ideal companion for your daily runs races and outdoor adventures
0, Don´t settle for subpar sunglasses when you can enhance your running experience with Sizzle shield sunglasses
0, Designed specifically for runners they exude the perfect combination of fashion and functionality
0, The extended wrap of the lens coupled with calibrated rigidity and low profile temples make Encoder an obvious choice for a broad range of sports across a variety of light conditions 
0, The progressive wrap design creates a unique look with superior coverage and enhanced field of view
0, Purpose built for use across multiple sport categories Encoder is a sport performance style designed with hat and helmet fit functionality in mind
0, Oversize rectangular masculine shape Web and the Sylvie motifs enameled on wirecore for a see through effect Classic colour palette of black and havana tones in contrast with Wirecore enameled House colors
0, This sun style features a standout wraparound frame and the iconic Return to Tiffany heart 
0, Square frames deliver high tech performance and classic style for these modern optical glasses 
0, The polarized lenses help prevent glare and the mirrored lens build delivers a vibrant look 
0, Enjoy a sunny day on the beach wearing the Blenders Eyewear Adults Class X2 Sunglasses 
0, Finished with Ralph branding lasered to the left lens and engraved to the gold toned hardware trim at the temples
0, They have a Square shape and come in 4 colors which are Black Brown Havana and Light Brown with 2 sizes which are 5217 145 and 5417 145 
0, Named after a well known surf spot on the Big Island these lightweight and durable sunglasses ensure performance and comfort 
0, Maui Jim Banyans Sunglasses provide unisex rectangle shaped frames designed to withstand the toughest of conditions
0, Translucent frames with contrast temples bring a fresh modern look to these squared off optical glasse styled with a keyhole bridge 
0, Dimensions Lens height 58 mm lens width 60mm bridge width 17mm
0, Polarized lenses offer superior visual clarity in oversized oval sunglasses that offer full coverage UV protection 
0, We know life isn't always smooth sailing but sometimes the smallest things can make it better
0, The SmartBuyGlasses prescription lenses option is a great choice so your eyeglasses arrive on your doorstep ready to wear
0, Our lenses are coated with a special advanced coating which renders them anti glare and scratch resistant
0, These Saint Laurent square sunglasses are a contemporary classic featuring dark tinted lenses set into thick acetate frames with logo embossing at the temples
0, These frames are a great fit with their Lavender Fields Violet color
0, Bold angular frames enhance the retro appeal of these Italian made sunglasses complete with logo accents at the temples 
0, The feminine cat eye frame shape pairs elegantly with the tubular temples in any of the chic colour choices including a full check option
0, ee without glare getting in the way thanks to the Maverick Lifestyle Polarized Square Sunglasses 
0, High protection against sunglare good UV protection not suitable for driving at twilight at night or under dull light
0, Sophisticated material mixes and glowing colours frame the architectural framework of contemporary Persol design 
0, Cat eye acetate frame sunglasses in black
0, bringing precision craftsmanship and a feminine vision to the label's signature edge
0, Defined with a curved browline these sunnies are finished with Ralph logo lettering imprinted onto the left lens and slender temples
0, From classic everyday looks to edgy playful styles shop our range of Armani Exchange frames for women and men and discover how Armani elegance transforms into a casual youthful and urban attitude
0, AX Armani Exchange glasses and sunglasses interpret the refined Armani style with a trendy modern touch
0, The non slip temples and integrated nose pads will prevent wobble while the optical hinges will provide a nice fit 
0, They are one of the best polarized fishing sunglasses on the market 
0, Polaroid is a company that generates innovation
0, Pucci's butterfly sunglasses are designed in a signature abstract print
0, Recommended use winter hiking leisure
0, Ski and snowboard goggles designed for daily wear
0, The dual layer polycarbonate lenses prevent warping while enhancing contrast to help you see bumps in the snow while the magnetic lens system allows you to adapt to constantly changing conditions
0, Richly gradient lenses and vibrantly hued temples enhance the glam vibe of sleek sunglasses fitted with full coverage UV protective lenses 
0, Ultra sleek fashionable lightweight and comfortable to wear
0, They have a Rectangle shape and come in 3 colors which are Black Crystal Havana and Dark Havana with size 5417 145 
0, They’re also worn by personalities like Henry Cavill one of the most fashionable actors in Hollywood
0, The Prizm Road lens is specifically designed to enhance your view so you can see obstacles such as rocks and ruts easily
0, Prizm Black Polarized are taken from the Performance collection from with a standard size frame which features an enhanced lens coverage with a deeper lens on the semi rimless frame which is given even more grip than previous incarnations with the stems as well as the nose pads fully covered with unobtanium that grips more with perspiration
0, They come in 3 colors which are Black Brown and Purple with size 4817 135 
1, Hand wash cold water separately lay flat to dry 
0, Durable nylon makes the Arc'teryx Essent High-Rise 28 Leggings your new go-to climbing legging 
0, Tight Fit
0, High Rise Waistband
0, Full Coverage 28 Length
0, Two Harness Friendly Pockets Stash Small Essentials
0, A huge seller at Patagonia that's just as at home at the coffee shop keeping you toasty at the computer or as a mid-layer under your outer shell the Patagonia Down Sweater uses the best and most sustainable of materials to create a slim-fitting puffy you'll find yourself reaching for day after day 
0, Two Zippered Hand Warmer Pockets
0, Interior Zippered Pocket
0, Adjustable Drawcord Hem – Hem adjusts by pulling cord in handwarmer pockets and releases with cordlocks at front hem 
0, Center Front Vislon Zipper – With wicking interior storm flap and zipper garage at chin for next-to-skin comfort 
0, Fair Trade Certified Sewn
0, Nylon Bound Elastic Cuffs – Comfortable keep sleeves at wrist and seal in warmth 
0, Regular Fit
0, Center Back – 72 cm
0, 2 Hand Pockets with YKK Zip Closure
0, Inside Stash Pockets
0, Inner Chest Pocket
0, Ski Pass Pocket
0, Life Pocket with Primaloft Insulation – Engineered to extend the battery life of your personal electronics the Life Pocket uses thermal materials and innovative construction to stay 3 times warmer than a conventional pocket 
0, Mesh Ventilation for Added Breathability
0, LifaLoft – LifaLoft insulation is a light and warm material combining Helly Hansen's unique LIFA technology with PrimaLoft insulation crafted with expertise LifaLoft retains more heat while remaining lightweight and comfortable during intensive activities 
0, It's not that you don't want to be fashionable it's just that the act of sliding on snow takes priority for you?
0, Check out the new Helly Hansen Motionista Lifaloft Jacket a fully featured insulated coat that'll keep your motor running even when the temps are trying their best to make it a challenge 
0, A healthy does of LifaLoft insulation keeps this jacket toasty and Helly Tech Performance technology keeps the water out for more fun more often on the slopes 
0, To find Zen in the unpredictable backcountry conditions you need a jacket that can keep up on both the high output ascents as well as the stormy descents and that's exactly where the Oyuki Nimi YamaPro 3L Jacket thrives 
0, Styled with a relaxed freeride fit the Goshiki Jacket is feature packed to meet the demands of hunting pow on backcountry adventures sidecounty missions and stacking lap after lap on stormy resort days 
0, YamaPro Always Dry technology keeps you protected from the elements with 20K 20K waterproof breathability Designed with articulated patterning that allows you to move freely without compromise plus backpack compatible pockets and a big helmet-compatible storm hood this jacket delivers performance from the skin track to the pillow line 
0, YamaPro Always Dry Technology – Designed and tested in Niseko Japan to keep you Always Dry and on the mountain longer 
0, Oyuki’s YamaPro has been rigorously tested to meet the relentless demands of riding big snow 
0, 20K Waterproof 20K Breathability
0, Custom Toshikazu Nozaka Artwork
0, Articulated Performance Patterning for Fit and Mobility
0, Hand Warmer and Chest Pockets
0, Secure Interior Pocket for Essentials
0, Interior Mesh Pocket for Larger Item
0, Zippered Sleeve Pass Pocket
0, Direct Interior Access Pocket – Designed to align perfectly with the Oyuki Insulator chest pocket or Oyuki bibs' chest pocket 
0, Pit Ventilating Zips with Under Arm Gusset
0, Backpack Compatible Pockets and Zips
0, Fully Seam Sealed with Custom Toshikazu Nozaka Artwork Tape
0, Helmet Compatible Storm Hood
0, Waterproof Exterior Zips
0, Shaped Cuffs
0, Powder Skirt
0, Flat Knit Toe Seam for Additional Comfort
0, Light Cushion on Shin Calf and Foot
0, Light Cushion
0, Paying homage to Oyuki’s birthplace Niseko Japan the Oyuki Pocket T-Shirt is a streetwear winter essential
0, Created with Oyuki’s key style principles in mind this garment is long lasting and easy to wear 
0, Niseko Tori Gates Graphic
0, Embrace everyday shred-tastic vibes with the evo Ice Dye Pocket Unisex T-Shirt!
0, The RVCA Kinney Mock Neck T-Shirt isn't just adorable it's a direct portal back to the golden era 
0, The pow day graphic adds a touch of fun inspiring your inner child to spread joy and stoke wherever you go 
0, Custom Ice Dye Design – Ice dye is the next evolution of tie dye that gives an unique design everytime 
0, Unique one off custom ice die technique design made exclusively for evo 
0, Give Together – evo donates 2 % of this purchase to youth-serving organizations in our community
0, Every child deserves a chance to achieve their potential
0, Cozy Soft Handed Yarn
0, Together we can equip young people facing the greatest need with the skills and support to thrive 
0, Long-Line Rib Knit Jumper
0, External Classics Flag Label At Side Seam
0, Funnel Neckline
0, Attached Hood – Has a pre-tensioned elastic opening for a secure fit 
0, Clean Front Hem with Flat-Sewn Elastic at Rear
0, Flat-Sewn Elastic Cuffs with Integrated Thumb Loops
0, Underarm Gussets – For better mobility 
0, No Shoulder Seams – For reduced bulk and extra comfort while you're wearing a pack 
0, Flat-Locked Stitching – In key zones for next-to-skin comfort
0, Side-Entry Hand Pockets with Elastic Binding to Help with Your Peace of Mind While You’re on the Move
0, Whether you're hitting your routine trails for a hike or exploring the slightly intimidating 14er you've been itching to check off your list this recycled polyester fleece jacket has got you covered 
0, With its durable construction and breathable fabric you'll stay comfortable and protected no matter the weather 
0, The North Face Summit Verbier GORE-TEX Bibs are your VIP pass to mountain summits 
0, Durable Water Repellant Finish
0, High-stretch water-resistant fabric 
0, 5 6-oz 50 % Recycled Cotton 50 % Postconsumer Recycled Polyester Jersey
0, Adapt the jacket to your needs with the waterproof side zippers for greater comfort
0, 100 % water repellent 
0, Full garment sewn with waterproof threads 
0, Ideal for when you're not quite sure what the conditions will be looking like the infiDRY membrane is both waterproof and breathable for long-lasting comfort day in and day out 
0, If you thought you couldn't get any smarter take a spin in the 686 Smarty 3-in-1 Form Jacket and see what happens 
0, Hyper Articulated Fit – Built specifically around skiing and snowboarding 
0, Secure Zip Bib Pocket with Internal Gear Clip Mesh Pouch and Cord Routing
0, Two Covered Secure Zip Thigh Pockets One with an internal gear clip and mesh pouch and one with a radio loop 
0, Hood Link System – Hoodlink adds new organization to your gear 
0, By adding a proprietary clip to the one-cinch hood adjuster and a single loop inside your hood your jacket can now be rolled up and transformed into a neat packable object 
0, Slide your accessories under the bungee and you have the perfect start to any trip 
0, The evo Polartec Hooded Pullover is a hybrid baselayer designed to keep you dry and warm even when physical exertion beckons
0, A top layer to add just enough warmth to make the day a success that packs to the size of nothing and weighs next to nothing in your pack?
0, Try the Outdoor Research Shadow Insulated Anorak on for size 
0, Polartec Knitted Fleece 64 % Recycled Polyester 36 % Polyester
0, Slim-fitting technical garments may be worn over baselayers and light midlayers 
0, The North Face Circaloft Jacket is designed to perform for you in life and recycle easily when it's covered in duct tape and the insulation has lost it's loft
0, Finding clothing as versatile as the evo lifestyle is hard to come by Alas the evo Burke Stretch Shorts 
0, Charge any trail with the Wildcat on your face full coverage hybrid construction cylindrical lens sunglasses
0, Not too tight not too loose Standard fitting apparel will fit over base and mid-layers without restricting movement 
0, A progressive take on a traditional chino A regular fit through the waist seat and thigh with a mellow taper through the knee and leg opening 
0, Backed backed with a wicking interior storm flap and zipper garage at chin for next-to-skin comfort
0, Hem adjusts by pulling cord in handwarmer pockets and releases with cordlocks at front hem
0, They might be growing in and out of their gear constantly but with these merino blend socks it'll be a little more comfy 
0, The Smartwool Light Cushion OTC Socks feature cushion common pressure points: the shin calf and foot 
1, Do not dry clean 
1, Do not iron
1, Tumble dry low 
1, Do not bleach 
1, Machine wash cold 
1, Wash with like colours 
1, Machine wash cold water with like colors gentle cycle wash inside out lay flat to dry 
1, To clean the suede uppers gently rub in the direction of the nap using a sponge soft-bristle shoe brush or cloth designed for cleaning suede
1, Clean the soles with a damp light-coloured cloth 
1, Avoid using soap or chemical cleaning products on any parts of the shoes 
1, Do not machine wash
1, Clean with a microfibre cloth
1, Check the label for washing
1, We recommend using a professional cleaning service
1, Machine washable
1, Machine wash
1, Do not bleach
1, Machine wash cold
1, Machine wash cold with like colors gentle cycle tumble dry low 
1, Recycled microfiber fabric 
1, Body 78 % Recycled Nylon 22 % Elastane Lining 88 % Nylon12 % Elastane 
1, Contrast 97 % Cotton 3 % Elastane 
1, Body 70 % Cotton 30 % Polyester 
1, Silk lining 
1, Composition 100 % Silk 
1, Rib knit fabric 
1, Body 57 % Cotton 38 % Modal 5 % Elastane 
1, This handcrafted style is made from calfskin with an exceptionally soft uniform natural grain
1, Details 100 % calfskin 75 % polyamide and 25 % elastane lining 100 % rubber sole 
1, Composition 76 % Polyamide 24 % Cotton 
1, Bra lining 81 % Nylon 19 % Lycra elastane 
1, Trim Middle layer 89 % Nylon 11 % Elastane
1, Specific Features Lining 100 % Suede
1, Composition 100 % Calfskin
1, Crafted from ultra-lightweight cotton and silk yarn
1, Lining 100 % Calfskin Soles 100 % Rubber
1, Crafted from natural pure cashmere yarn this cropped V-neck jumper is defined by a fluffy soft texture micro-perforated motif and exceptionally comfortable light weight
1, Composition 100 % Cashmere
1, Crafted from naturally fresh compact linen crêpe it is a versatile sporty accessory
1, Linen lining with grosgrain trim
1, Composition 100 % Linen
1, Slippers made from soft Cashfur an innovative cashmere-and-silk fabric that uses only the softest most meticulously selected fibres
1, Composition 85 % Cashmere 15 % Silk
1, Insoles 100 % Cashmere
1, Soles 100 % Rubber
1, Rectangular beach pillow made from cotton terrycloth
1, Composition 100 % Cotton
1, Specific Features 84 % Viscose 16 % Polyester
1, These long legwarmer socks are crafted from natural pure cashmere yarn
1, Composition 100 % Cashmere
1, Composition 100 % Cashmere
1, Crafted from naturally fresh lightweight linen crêpe canvas it is enhanced through the use of archival designs and special finishes that make the fabric exceptionally soft and flowing
1, Composition 100 % Linen
1, Cotton elastane
1, Cotton spandex
1, Polyester spandex
1, Trim filling 75 % Recycled polyester 25 % Polyester
1, Outer back upper panel 65 % Nylon 35 % Elastane
1, Cotton modal fabric
1, Body 57 % Cotton 38 % Modal 5 % Elastane
1, Dry clean only
1, Machine washable
1, Wipe clean only
1, Do not use biological detergent
1, Do not iron print
1, Do not dry clean
1, Wash at 30 degrees
1, Do Not Bleach
1, Do Not Tumble Dry Or Iron
1, Wash With Like Colours
1, And you can head to the showers in style with the iconic Castore jacquard branding on your new favourite towel 
1, do not iron print wash with similar colours
1, wash inside out
1, turn inside out before washing to avoid snagging
1, do not dry clean
1, iron at maximum sole plate tempurature 110*C without steam
1, do not tumble dry
1, Mild wash process at 30 degrees
1, Normal wash process at 30 degrees
1, Iron at maximum sole plate temperature 110 degrees without steam
1, Crewneck Fleece lining
1, Available as a single sweater or in a pack of two it also comes in an array of colours
1, Finished with fleece lining and a ribbed detailing along the neckline and cuffs this crew neck is ideal for layering over school shirts
1, Made from a cotton-rich blend for a comfortable feel this blue crew-neck sweater is an ideal addition to their school uniform
1, 80 % Cotton 20 % Polyester
1, Main 99 % Cotton 1 % Elastane Lining 55 % Polyester 45 % Cotton
1, 61 % Polyester 35 % Cotton 4 % Elastane
1, 100 % Plastic
1, Main 80 % Plastic 20 % Metal Lens 100 % Plastic
1, Main 100 % Cotton Lining 100 % Polyester
1, made using synthetic acrylate glue
1, Made from natural rubber they are soft supple flexible and comfier for little feet than plastic wellingtons
1, Made from natural rubber they are soft supple flexible and comfier for little feet than plastic Wellington boots
1, 67 % Cotton 30 % Polyester 2 % Elastane 1 % Nylon
1, 100 % Lambswool
1, 3 THREAD BRUSHED - 70 % COTTON 30 % POLYESTER 
1, 98 % Polyamide 2 % Elastane
1, 82 % polyamide 18 % elastane
1, made from a premium cotton and polyester fabric blend
1, Polyester and cotton-blend fabric 
1, 100 % cotton
1, Made from high-quality 100 % cotton our Gym Towel is a must-have to keep the sweat at bay throughout your workout
1, 100 % organic cotton 
1, 100 % Polyester
1, 82 % polyester 18 % elastane
1, Use mild detergent
1, Close all closures before washing
1, If the garment is drying in the air turn and shake several times
1, Filling 50% Duck Down 50% Duck Feather
1, Upper Material 100% Polyester
1, Lining 100% Polyester
1, Wash and iron inside out
1, Base Yarn 100% Cotton
1, Upper Material 100% Polyester
1, Dry flat
1, Use mild detergent
1, Do not iron the ornaments
1, Made from a blend of 95 % polyester and 5 % elastane with a lining of 95 % polyester and 5 % elastane this dress offers both comfort and style
