verdict,text
0, Tall hiking boots in technical cotton garbardine with padded collars for added comfort
0, Not too short not too long just right around the waistband 
0, The shoulder strap features two holes so its length can be adjusted allowing the bag to be carried by hand over the shoulder or as a crossbody style 
0, A detachable cotton-and-leather shoulder strap wraps around the entire bag like a ring 
0, The micro version of the Bale Bag combines elegance and tradition in a minimalist modern design 
0, Its name and cube-shaped silhouette is inspired by cashmere storage bales strongly evoking Loro Piana’s artisanal expertise 
0, Loro Piana’s distinctive heritage is embodied in the Bale Bag — a new icon of laidback timeless elegance 
0, Logo label at front waist 
0, Side slits 
0, Narrow straps 
0, Deep scoop neckline 
0, Our Rib Xssentials Tank features a deep scoop neckline our X logo on the front waist and side slits 
0, Laidback but always ready to stunt 
0, Relaxed fit 
0, Take extra 1 of the precious elements so that the raw 2 retain their natural structure and texture 
0, Take special 1 of your Loro Piana product to prolong its life 
0, Model measures height 5' 97 177cm bust 276 70cm waist 228 58cm hips 335 85cm 
0, Fastens with a belt 
0, Three-quarter sleeves 
0, An exaggerated fit that feels extra roomy 
0, Three-quarter sleeves 
0, Double-stitched moustache and handsewn trim
0, The soles feature a new version of the LP logo 
0, The boots are lined with lightweight and breathable kummel-coloured technical material with an antibacterial treatment 
0, Loro Piana’s rich heritage is embodied in a capsule collection defined by natural shades providing a new concept of everyday luxury and comfort for the coldest days of the year
0, Featuring a light balloon hem it is perfect for leisure-time lounging and in casual looks
0, Front and back yoke
0, Crafted with only one centre seam
0, Model wears an IT S
0, Model measures height 5' 109 180cm bust 307 78cm waist 244 62cm hips 358 91cm
0, Product Code FAN1844
0, Take special care of your Loro Piana product to prolong its life
0, Take extra care of the precious elements so that the raw materials retain their natural structure and texture
0, Loro Piana products are designed to evolve over time developing their unique character
0, This classic summertime baseball cap is defined by a soft lightweight deconstructed design
0, Its sleek silhouette is enhanced by distinctive sophisticated details
0, Monochromatic covered elastic insert at the back
0, Front embroidery with artichoke and cursive Loro Piana logo
0, Loro Piana’s rich heritage is embodied in a capsule collection defined by natural shades providing a new concept of everyday luxury and comfort for the coldest days of the year
0, Their unique finishing treatment brings out the refined qualities of the raw materials guaranteeing the cashmere’s natural comfort and pleasant feel
0, Thanks to lightweight rubber soles featuring the LP logo they are perfect for leisure-time relaxation
0, Incredibly fluffy warm clothing and lifestyle accessories that feel pleasant against the skin combining freedom of movement and extremely high-quality raw materials
0, This soft lightweight style is enhanced with Loro Piana’s iconic Suitcase Stripes making it perfect for the beach or resort
0, Dimensions 40 x 25 cm 157 x 98 
0, Loro Piana’s rich heritage is embodied in a capsule collection defined by natural shades providing a new concept of everyday luxury and comfort for the coldest days of the yea
0, A half English rib knit enhances the inherent softness and stretch of the toasty soft fibre
0, Incredibly fluffy warm clothing and lifestyle accessories that feel pleasant against the skin combining freedom of movement and extremely high-quality raw materials
0, Blanket with fringe trim in super-soft baby cashmere featuring two narrow contrasting bands
0, The name recalls the age in months of the Hircus goat kids before which this exclusive fibre has to be harvested
0, Invitingly warm and very refined perfect for both city interiors and mountain getaways
0, Size 190 x 140 cm
0, Rare supersoft baby cashmere is obtained solely from the underfleece of Hircus goat kids
0, Loro Piana logo ring on one edge
0, Featuring draped shoulders this long dress embodies the dynamic adventurous spirit of the Andes
0, Its slinky figure-enhancing silhouette provides an elegant feminine allure
0, Closure on the left shoulder with metal logo buttons
0, Everything you like about Levi's 511 Slim but updated with a narrow fit through the thigh and tapered leg
0, The 512 Slim Taper Jean has a tailor-inspired cut that works best for slimmer builds
0, Tapered leg 1275 leg opening
0, Immense comfort and modern style combine to make these slim-fit Core 1 jeans from INC International Concepts® the perfect choice for your new favorite pair
0, Front pockets welt pockets at back
0, Club Room makes it easy to get up and at 'em with the comfort and style of this business-casual button-front in stretch cotton
0, Bring a modern feel to your business-ready look with these dress boots from Club Room featuring sleek faux-leather uppers and padded collars for all-day comfort
0, Made from cozy cashmere Charter Club's turtleneck sweater is ready to keep you warm in style
0, Our three-button cardigan features a shaker-stitch knit and a classic V-neck that's perfect for layering all year long
0, ABOUT THE BRAND Our new brand was designed for and with women like you
0, Made for your body your style and your truth
0, As your wardrobe's best friend these mix-and-match pieces work with everything in your closet
0, Slip into a sophisticated menswear-inspired look with the classic tailoring and hardware details on these Dailyn loafers from Giani Bernini
0, Foot-molding memory foam sock with extra cushion at the heel
0, This wonderfully warm down vest has a cinchable hem that lets you customize the shape and keep out cold drafts
0, Our Savage X Boxer Briefs feature a matte logo waistband and contoured front pouch for ultimate all-day comfort and support
0, Front contour pouch
0, Matte logo elastic waistband
0, For a versatile outdoor training layer that keeps you agile cool and visible at night look no further than our Men’s Active Mesh Quarter Zip Top
0, Strategically located mesh fabric is engineered to deliver airflow where you need it most with a convenient quarter zip for further temperature regulation
0, Castore branding at left chest
0, Reflective detailing
0, Centre front quarter zip 
0, Back ventilation for improved breathability
0, High-stretch quick-drying fabric
0, Funnel neckline
0, The INEOS Performance Cap is the perfect choice for outdoor activities
0, Constructed with soft lightweight fabric the cap provides protection from the sun's rays and is breathable to keep you cool
0, The adjustable back closure ensures a comfortable fit 
0, Look and feel the part when hitting the gym in our Short Sleeve Raglan Tee
0, Featuring the iconic Castore branding on the chest and sleeve you’ll look the height of style And with raglan sleeve construction you can enjoy an unlimited range of movement during every indoor workout 
0, Raglan sleeve 
0, Self-fabric collar at neck
0, The Protek midweight Insulated Jacket is a perfect wardrobe addition to wear before and after your workout 
0, Clear and bold branding 
0, Shower-resistant it’s particularly useful in adverse weather conditions 
0, Show off your support for the Stags with the Junior’s Mansfield Away Shirt
0, Available in a Flame Scarlet colourway this shirt is a must-have for any passionate Mansfield fan
0, Designed with set-in sleeves a cross-over V-neck collar and twin stitch needling at the hem the Shirt’s intricate details pay homage to the dedication of the fans players and historic legacy of the club
0, Ribbed Knit at Neckline and Taped Shoulder Seams for Comfort
0, Centre front full zip
0, Push for better in the elements with the Men’s Zone Hybrid Jacket
0, Castore branding at collar and sleeve
0, Reflective detailing ensures you can continue in low visibility and padded panels provide added warmth – so nothing stops you from performing
0, Complete with a dynamic screen-printed graphic on a high-stretch fabric to ensure that you’ll stand out whatever the weather
0, Give your feet the support and comfort they deserve with our Golf Ankle Sock 
0, This core golfing accessory enhances breathability with mesh panelling ensuring you feel fresh on the course all day
0, Go beyond your limits with the Women’s Protek Performance Tank Top
0, The fitted style offers a sleek silhouette
0, Complete with a racer-style vest at the back and mesh side panels for enhanced breathability this Tank Top is designed to take your performance to new heights
0, Our soft Protek Performance Legging will keep you secure and comfortable during your workouts thanks to minimum flat seaming and a supportive waistband
0, For added convenience the high-stretch and quick-drying bottoms feature an internal back pocket too
0, Dimensions W52cm x H28cm x D28cm 
0, You can also customise your bag for style and comfort with an adjustable or removable padded strap 
0, Everyday ankle socks for athletes
0, Offering crafted and comfortable support for day-to-day life and a stretch fit with rib detailing that ensures they stay perfectly in place whether you’re at work or working out
0, Finished off with a clean-cut design
0, Style these Junior’s Charlton Away Shorts with a matching Away Shirt to get the complete look of the pros
0, With a subtle graphic to the side seam a contrast panel on the back legs and the Red Robins club crest to the leg everyone will know where your loyalties lie
0, This Protek V-neck Long Sleeve Tee has been engineered for moderate- to high-intensity training with a slim athletic fit for improved comfort
0, The sweat-wicking material also ensures you get the most out of your workouts 
0, High-stretch breathable and quick-drying fabric 
0, Slim athletic fit 
0, Perfect for kicking back by the circuit this Core Overhead Hoodie is a quality comfort piece from the Oracle Red Bull Racing Core Monobrand collection
0, with a brushback overhead hood for even greater comfort
0, Push your limits despite the elements in the Junior’s Standard Track Jacket
0, The sleek fit pairs with a funnel neckline for enhanced protection while set-in long sleeves provide warmth and support on colder training days
0, Castore branding at left chest
0, Centre front full zip
0, Set-in long sleeves
0, Funnel neckline
0, Description Stay warm this season with our Ultra Snood engineered from high-stretch fabric so it’ll never compromise your movement
0, The mesh front panel provides optimum breathability while the elastic fastening offers flexibility to find the perfect fit
0, Made from lightweight stretchy material in a closer-to-the-body fit you’ll look stylish and feel comfortable while you train
0, Your go-to sportswear for low- to moderate-impact training the Protek 1 4 Zip Top allows for a wide range of movement
0, Asymmetric neck
0, Long sleeves
0, Knitted jumper
0, Ribbed trims
0, Crew silhouette covers your ankle and lower calf
0, Ribbed arch band offers a supportive feel
0, Power through your workout with the Nike Everyday Cushioned Socks
0, The thick terry sole gives you extra comfort for footdrills and lifts while a ribbed arch band wraps your midfoot for a supportive feel
0, Dri-FIT technology helps keep your feet dry and comfortable
0, Thick terry sole provides comfort and impact absorption
0, Make a splash!
0, Perfect for even the greyest days these tall wellies are designed with chunky treads and decorative buckle fastenings at the calf
0, Tackle drizzly days in style with our leopard print patent wellington boots at an on-trend ankle length with chunky treads
0, Our wellies are without a doubt one of our most popular products and this season they're available in this modern ankle-length style complete with cosy fleece lining
0, The sole is gently ridged and grippy giving a little extra stability on wet ground - perfect for jumping in muddy puddles all day long!
0, Our Children's Wellies are without a doubt one of our most popular products and are available in plenty of great colours to co-ordinate with our outerwear styles
0, The sole is gently ridged and grippy again in lighter weight rubber to make them not as heavy as other brands
0, Ridged soles for grip
0, With anti-sweat lining they're comfortable enough for all-day wear splashing in those puddles
0, Wellie boot bags available to help keep cars and floors clean
0, With anti-sweat lining they're comfortable enough for all-day wear splashing in those puddles
0, Anti-sweat lining
0, Designed with a contrast black satin shawl and a lapel pin complemented further by the satin-covered buttons
0, Make a statement with this contemporary velvet jacket
0, Padded tongue and collar with modern top line
0, Archival-inspired eyerow and overlays with crafted stitching details
0, Just in time for cooler weather the Chuck Taylor All Star Malden Street gets refreshed for fall
0, On-trend color palette
0, OrthoLite cushioning for all-day comfort
0, Mid-top shoe with faux leather upper
0, from open fields to crowded streets
0, Grounded tones encourage you to explore your surroundings
0, these structured Chucks are easy to wear all year long wherever you go
0, Bringing together faux leather in trending colors
0, Just in time for cooler weather the Chuck Taylor All Star Malden Street gets refreshed for fall
0, Welcome our round polarised sunglasses into your accessory arsenal for effortless appeal
0, Not just a stylish addition to your sunny-day ensembles they keep your eyes shielded with their high-quality polarised lenses
0, Ready for anything from beach visits to street-style statements they come with a soft case for when you're on the move
0, Ray-Ban Cats 5000 Classic sunglasses feature a reinterpretation of the iconic Aviator into a lightweight propionate plastic frame material
0, Super soft fleece lined legging
0, Quality comfort fit
0, Warm and cosy
0, The iconic clog that started a comfort revolution around the world now with adorable built-in glitter all over!
0, It's the irreverent go-to comfort shoe that you're sure to fall deeper in love with day after day 
0, Incredibly light and fun to wear
0, Ventilation ports add breathability and help shed water and debris
0, Easy to clean and quick to dry
0, Pivoting heel straps for a more secure fit
0, your ultimate style destination for all of life’s essentials
0, With quality at the heart of everything we do Next interprets the latest trends to create modern effortless easy-to-style pieces for your home and wardrobe
0, The unique gathered shoulder sleeves add a feminine touch to the overall design
0, Shop now and enhance your collection of casual dresses!
0, Enhance your casual look with a touch of high style with these designer images Crafted in quality materials with a lovely hue that graces its expanse this pair is a must-have
0, Shades of light blue and green can be seen throughout as the slim cropped silhouette is finished with subtle woven branding along the bottom hem
0, Butterfly Garden Green Crop T-Shirt from Petals by Petals and Peacocks
0, The shirt is decorated with the iconic Santa Cruz Dot logo at the left chest as well as a larger logo graphic at the back with a mountain range and fish
0, Knockout Green T-Shirt from Girl
0, Screen-printed graphic on front
0, Live Laugh Love Black & White Raglan Crop Long Sleeve T-Shirt from JV by Jac Vanek
0, This product was made in a factory where RISE programs advance women's empowerment and gender equality
0, Smart sophistication gets a step up in the chunky block heels and walkable platforms of the sleek Tiannaa booties from Sun + Stone
0, Layered appearance with a grey short sleeve tee and long sleeves with green ands black stripes throughout
0, Stretchy vibrant and fashionable what's not to love? The A-Lab Patina is outfitted in a wonderful tie-dye blend of pink and purple and has a slim cropped long-sleeve silhouette that's accented by the lettuce detailing on both the sleeves and bottom hem
0, Your new favorite 30-liter travel duffel has a smart shape and sturdy yet light structure making packing easier than ever
0, With a large U-shaped opening bag access is easy
0, The bag’s construction is unusually strong for a duffel
0, It stays standing upright even when empty making packing a breeze
0, Interior pockets let you separate shoes from clothes or clean and dirty garments
0, The bag also features hidden padded shoulder straps in the top lid pocket if you prefer to carry your duffle like a backpack
0, Like all our travel bags the main zipper is lockable
0, Our most ergonomic duffel with a smart sturdy structured design
0, Suave elegance for this smooth all-leather wallet adorned with an understated brushed metal crocodile
0, Timeless and impeccable
0, Basic long sleeve sweater available in various colours with a high neck and ribbed trims
0, Two must-have bags for the value of one! No Boundaries’ 2-Piece Gift Set features a mini backpack and fanny pack to effortlessly switch up your style to complement any look
0, These lightweight durable breathable gym gloves adhere to the palm of your hand to ensure maximum grip
0, This style is customised with a contrasting logo
0, Cut in a slim fit these five-pocket jeans feature a dark wash making them a cool alternative to your everyday denim Dress them up with a crisp shirt or wear them on the weekends with an easygoing pullover
0, The primary materials that compose this product contain a minimum of 20 percent recycled content
0, Stay fresh with these gorgeous sneakers from Athletic Propulsion Labs APL !
0, Vegan construction
0, Pull-tab at the back for easy on-and-off
0, Brand name logo featured at the center of the tongue
0, This pair feature a zipped fly with button fastening belt loops and an adjustable waist for a more secure fit and the classic five pockets for denim that include a branded coin pocket 
0, Finished with the brand's signature logo emblazoned to the rear branding patch
0, Add a unique look to your activewear with this contemporary sneaker enhanced with an allover geometric pattern The sturdy sole and lace-up fit give your feet plenty of comfortable support
0, Featuring printed back neck labels which are supersoft on baby’s neck 
0, These sleepsuits have integral scratch mitts up to 3-6 months and the feet are designed with lined inners for comfort
0, Nickel-free poppers ensure no irritation to delicate skin and no harmful dyes or chemicals have been used keeping your baby safe
0, Each sleepsuit features a fun character design to brighten their very first wardrobe
0, T-shirt by Daily Paper short sleeves ribbed crewneck collar and embroided brand's logo on the front
0, Details Two-tone Printed text with Hood Long sleeves Knit cuffs Drawstring on the hood Fantasy cut
0, A velvety suede Hat Attack baseball cap with a luxe modern look
0, Stock up on your youngster's comfy collection with this lightweight hoodie sporting a whimsical line from a classic carol
0, Molded underwire cups lend structure to this Elle Macpherson Intimates bra cut in a delicate mix of lace and mesh
0, This classic henley is a must-have thanks to comfy fabric athletic rugby stripes and a timeless henley profile Pair with denim or chinos for a crisp casual look
0, Three-button henley placket
0, This high-waisted pleated skirt delivers on both drama and elegance
0, Falling just below the knee in an A-line silhouette this piece is the perfect length for every setting or occasion
0, Best paired with a crop top or fitted tank
0, Slip on glitter flats from Lucita for your little lady
0, The gold ballerina shoes features shimmery texture all over and a convenient slip on design
0, It features synthetic upper and manmade sole
0, It will lend delicacy and a feminine touch complementing her outfits
0, Features Elastic Cuffs Internal Pockets Zipper or Storm Flap
0, For over 200 years we have been producing fashionable and timeless bags
0, However our strengths include not only the production but also the development and technical implementation
0, We attach particular importance to the seamless combination of the designer's vision with the inventions and innovations of our technology experts to stylish innovative bag creations
0, n a gorgeous fit and flare shape the camilla floral dress is easily paired back with platform sneakers for that sporty vibe or with bootsslides for a dressy night look
0, Adorned with the nautical stripes this classic Harbour style has long sleeves a flattering boat neckline and a relaxed fit
0, The ultimate magisculpt straight leg trouser with exclusive built in support panel to control your tummy
0, Comfort fit stretch waistband with functional zip fastening
0, Distressed along the sole for a vintage look the Superstar sneakers from Golden Goose are a directional choice for casual rotations
0, Accented with the signature star appliqué the low-top silhouette is crafted in leather with logo embossing to the heel tab
0, Inspired by retro athletic sneaker styling these low-tops feature logo accents throughout finished with bright orange detailing for a bold look
0, Whether you're rocking the California Republic Bear Flag or one of our popular sea life designs this hoodie won't let you down
0, Don't settle for anything less than the original - California Republic Clothes
0, As a side effect of the screen-printing process you may see a small faint box on your shirt sweatshirt
0, All our products are backed by our top-notch customer service
0, Be seen in one of the highest-quality classic fit pullover hoodies around
0, For over 30 years California Republic Clothes products have been printed in beautiful San Luis Obispo California and we use only the finest garments
0, Our hooded sweatshirts are ultra comfy and use air jet yarn which results in a softer feel and reduced pilling
0, Add a smart feel to your off-duty look in this elegant Formal T-Shirt from Oasis
0, Crafted in a lightweight blend with a scoop neckline fitted shape and short sleeves to finish
0, Versatile by nature team with tailored trousers at the office or add skinny jeans and espadrilles for a chic daytime ensemble
0, Designed to be that perfect “extra layer all year long in soft yet rugged twill with incredible texture
0, Our all-season shirt jac is the grab-and-go layer you’ll reach for again and again
0, We chose a soft comfortable twill fabric with substantial texture that looksand feels great
0, Containing an aqua blue unicorn cross back vest top with a silver glitter slogan plus matching white printed shorts it's perfect for nightwear
0, Crafted with high quality stones this pendant is the perfect accessory for any ensemble on any occasion
0, Our complimentary 18 Chain makes sure that this piece is stunning and all around flattering
0, Get wonderful comfort and support with the Zero Feel bralette made from supersoft 360° stretch jersey with extra- flat seamless finish
0, For maximum freedom of movement ultimate comfort and zero weight the bralette comes with seamless cups for an ultra discreet wear
0, The pads are also removable for a gentle shaping effect
0, Our top-selling silhouette is now available in hand-crochet
0, Our Sequoia crochet hobo is an easy everyday choice with a spacious interior that easily collapses to pack or organize
0, The sak is b corp certified given to companies that meet the highest standards in creating a positive social and environmental impact while highlighting their commitment to people products and the planet
0, Comfortable and stylish cotton tee ideal for outdoor and every day wear 
0, The North Face Men’s Redbox Tee combines a cosy cotton construction with a crew neck to improve comfort and fit during activities
0, White knitted jacquard top from Ermanno Scervino
0, These pants have been made with the hard working individual in mind
0, There is nothing worse than having a pair of pants fall apart on you after only having worn them a handful of times
0, Whether you are looking for clothes for work or for home we have got it all
0, No matter your profession we have the work pants you need from indoor medical retail and academic professions to outdoor yard work construction and welding
0, We have a variety of styles materials and colors to ensure that you find exactly what you need
0, Driven by a relentless pursuit of innovation as well as decades of accumulating sports science expertise we cater for all from elite professional athletes and teams to any individual who wants to make sport part of their lives
0, Featuring essential lines and a minimalist look these shoes feature a lightweight breathable mesh upper
0, Extra soft cushioning provides extended comfort
0, This Mac Duggal satin gown features a draped strapless bodice
0, A full A-line skirt with a high-low bubble hem defines the look
0, Item made in Italy synonymous with quality and design creativity
0, knitted mélange medium-weight knit no appliqués two-tone crewneck long sleeves no pockets
0, From durable chore jackets to checked wool cardigans loose carpenter trousers and cosy beanie hats meet your new everyday uniform 
0, Inspired by the workwear of the 1970s midlands working class town that founder David Keyte grew up in Universal Works offers menswear designed in Nottingham and produced in small quantities
0, With its structure and soft touch it's perfect for everyday wear 
0, It not only wears well but also exudes an appealing aesthetic 
